numero_questao,enunciado,alternativas
46,"Em uma flauta, as notas musicais possuem 
frequências e comprimentos de onda (λ) muito bem 
definidos. As figuras mostram esquematicamente 
um tubo de comprimento L, que representa de forma 
simplificada uma flauta, em que estão representados: 
em A o primeiro harmônico de uma nota musical 
(comprimento de onda λA), em B seu segundo harmônico 
(comprimento de onda λB) e em C o seu terceiro 
harmônico (comprimento de onda λC), onde λA > λB > λC.
L
A
B
C
Em função do comprimento do tubo, qual o comprimento 
de onda da oscilação que forma o próximo harmônico?",A: L; B: L; C: L; D: L; E: 6L
47,"Durante a aula, um professor apresentou uma 
pesquisa nacional que mostrava que o consumo de sódio 
pelos adolescentes brasileiros é superior ao determinado 
pela Organização Mundial da Saúde. O professor, então, 
destacou que esse hábito deve ser evitado.
A doença associada a esse hábito é a",A: obesidade.; B: osteoporose.; C: diabetes tipo II.; D: hipertensão arterial.; E: hipercolesterolemia.
48,"O cladograma representa, de forma simplificada, o 
processo evolutivo de diferentes grupos de vertebrados. 
Nesses organismos, o desenvolvimento de ovos 
protegidos por casca rígida (pergaminácea ou calcárea) 
possibilitou a conquista do ambiente terrestre.
O surgimento da característica mencionada está 
representado, no cladograma, pelo número","A: 1.; B: 2.; C: 3.; D: 4.; E: 5."
49,"Um eletricista projeta um circuito com três lâmpadas 
incandescentes idênticas, conectadas conforme a figura. 
Deseja-se que uma delas fique sempre acesa, por isso é 
ligada diretamente aos polos da bateria, entre os quais se 
mantém uma tensão constante. As outras duas lâmpadas 
são conectadas em um fio separado, que contém uma 
chave. Com a chave aberta (desligada), a bateria fornece 
uma potência X.
2
Chave
Bateria
Assumindo que as lâmpadas obedeçam à Lei de Ohm, 
com a chave fechada, a potência fornecida pela bateria, 
em função de X, é:","A: 2
 X.; B: X.; C: 3
 X.; D: 2X.; E: 3X."
50,"O urânio é um elemento cujos átomos contêm 92 prótons, 
92 elétrons e entre 135 e 148 nêutrons. O isótopo de 
urânio 235U é utilizado como combustível em usinas 
nucleares, onde, ao ser bombardeado por nêutrons, sofre 
fissão de seu núcleo e libera uma grande quantidade 
de energia (2,35×1010 kJ/mol). O isótopo 235U ocorre 
naturalmente em minérios de urânio, com concentração 
de apenas 0,7%. Para ser utilizado na geração de 
energia nuclear, o minério é submetido a um processo 
de enriquecimento, visando aumentar a concentração do 
isótopo 235U para, aproximadamente, 3% nas pastilhas. 
Em décadas anteriores, houve um movimento mundial 
para aumentar a geração de energia nuclear buscando 
substituir, parcialmente, a geração de energia elétrica 
a partir da queima do carvão, o que diminui a emissão 
atmosférica de CO2 (gás com massa molar igual a 44 g/mol). 
A queima do carvão é representada pela equação química:
C (s) + O2 (g) → CO2 (g)       ∆H = −400 kJ/mol
Qual é a massa de CO2, em toneladas, que deixa de ser 
liberada na atmosfera, para cada 100 g de pastilhas de 
urânio enriquecido utilizadas em substituição ao carvão 
como fonte de energia?","A: 2,10; B: 7,70; C: 9,00; D: 33,0; E: 300"
51,"O cobre presente nos fios elétricos e instrumentos 
musicais é obtido a partir da ustulação do minério 
calcosita (Cu2S). Durante esse processo, ocorre o 
aquecimento desse sulfeto na presença de oxigênio, de 
forma que o cobre fique “livre” e o enxofre se combine 
com o O2 produzindo SO2, conforme a equação química:
Cu2S (s) + O2 (g) ∆ 2 Cu (l) + SO2 (g)
As massas molares dos elementos Cu e S são, 
respectivamente, iguais a 63,5 g/mol e 32 g/mol.
CANTO, E. L. Minerais, minérios, metais: de onde vêm?, para onde vão? 
São Paulo: Moderna, 1996 (adaptado).
Considerando que se queira obter 16 mols do metal em 
uma reação cujo rendimento é de 80%, a   massa, em 
gramas, do minério necessária para obtenção do cobre 
é igual a","A: 955.; B: 1 018.; C: 1 590.; D: 2 035.; E: 3 180."
52,"Sais de amônio são sólidos iônicos com alto ponto de fusão, muito mais solúveis em água que as aminas 
originais e ligeiramente solúveis em solventes orgânicos apolares, sendo compostos convenientes para serem 
usados em xaropes e medicamentos injetáveis. Um exemplo é a efedrina, que funde a 79 °C, tem um odor 
desagradável e oxida na presença do ar atmosférico formando produtos indesejáveis. O cloridrato de efedrina funde a 
217 °C, não se oxida e é inodoro, sendo o ideal para compor os medicamentos.
OH
OH
CH
CH
NHCH
+NH2CH3
HCl
Cl
+
Cloridrato de efedrina
Efedrina
−
SOUTO, C. R. O.; DUARTE, H. C. Química da vida: aminas. Natal: EDUFRN, 2006.
De acordo com o texto, que propriedade química das aminas possibilita a formação de sais de amônio estáveis, 
facilitando a manipulação de princípios ativos?",A: Acidez.; B: Basicidade.; C: Solubilidade.; D: Volatilidade.; E: Aromaticidade.
53,"Além de ser uma prática ilegal, a adulteração de combustíveis é prejudicial ao meio ambiente, ao governo e, 
especialmente, ao consumidor final. Em geral, essa adulteração é feita utilizando compostos com propriedades físicas 
semelhantes às do combustível, mas de menor valor agregado.
Considerando um combustível com 20% de adulterante, a mistura em que a adulteração seria identificada visualmente é",A: etanol e água.; B: etanol e acetona.; C: gasolina e água.; D: gasolina e benzeno.; E: gasolina e querosene.
54,"Sabe-se que nas proximidades dos polos do planeta Terra é comum a formação dos icebergs, que são grandes 
blocos de gelo, flutuando nas águas oceânicas. Estudos mostram que a parte de gelo que fica emersa durante a 
flutuação corresponde a aproximadamente 10% do seu volume total. Um estudante resolveu simular essa situação 
introduzindo um bloquinho de gelo no interior de um recipiente contendo água, observando a variação de seu nível 
desde o instante de introdução até o completo derretimento do bloquinho.
Com base nessa simulação, verifica-se que o nível da água no recipiente","A: subirá com a introdução do bloquinho de gelo e, após o derretimento total do gelo, esse nível subirá ainda mais.; B: subirá com a introdução do bloquinho de gelo e, após o derretimento total do gelo, esse nível descerá, voltando 
ao seu valor inicial.; C: subirá com a introdução do bloquinho de gelo e, após o derretimento total do gelo, esse nível permanecerá 
sem alteração.; D: não sofrerá alteração com a introdução do bloquinho de gelo, porém, após seu derretimento, o nível subirá devido 
a um aumento em torno de 10% no volume de água.; E: subirá em torno de 90% do seu valor inicial com a introdução do bloquinho de gelo e, após seu derretimento, o 
nível descerá apenas 10% do valor inicial."
55,"A rede elétrica de uma residência tem tensão de 
110 V e o morador compra, por engano, uma lâmpada 
incandescente com potência nominal de 100 W e tensão 
nominal de 220 V.
Se essa lâmpada for ligada na rede de 110 V, o que 
acontecerá?","A: A lâmpada brilhará normalmente, mas como a tensão 
é a metade da prevista, a corrente elétrica será o 
dobro da normal, pois a potência elétrica é o produto 
de tensão pela corrente.; B: A lâmpada não acenderá, pois ela é feita para trabalhar 
apenas com tensão de 220 V, e não funciona com 
tensão abaixo desta.; C: A lâmpada irá acender dissipando uma potência de 
50 W, pois como a tensão é metade da esperada, a 
potência também será reduzida à metade.; D: A lâmpada irá brilhar fracamente, pois com a metade 
da tensão nominal, a corrente elétrica também será 
menor e a potência dissipada será menos da metade 
da nominal.; E: A lâmpada queimará, pois como a tensão é menor do 
que a esperada, a corrente será maior, ultrapassando 
a corrente para a qual o filamento foi projetado."
56,"A obtenção de sistemas coloidais estáveis depende 
das interações entre as partículas dispersas e o meio 
onde se encontram. Em um sistema coloidal aquoso, 
cujas partículas são hidrofílicas, a adição de um solvente 
orgânico miscível em água, como etanol, desestabiliza 
o coloide, podendo ocorrer a agregação das partículas 
preliminarmente dispersas.
A desestabilização provocada pelo etanol ocorre porque","A: a polaridade da água no sistema coloidal é reduzida.; B: as cargas superficiais das partículas coloidais são 
diminuídas.; C: as camadas de solvatação de água nas partículas 
são diminuídas.; D: o processo de miscibilidade da água e do solvente 
libera calor para o meio.; E: a intensidade dos movimentos brownianos das 
partículas coloidais é reduzida."
57,"Dentre outras características, uma determinada 
vegetação apresenta folhas durante três a quatro meses 
ao ano, com limbo reduzido, mecanismo rápido de 
abertura e fechamento dos estômatos e caule suculento. 
Essas são algumas características adaptativas das 
plantas ao bioma onde se encontram.
Que fator ambiental é o responsável pela ocorrência 
dessas características adaptativas?",A: Escassez de nutrientes no solo.; B: Estratificação da vegetação.; C: Elevada insolação.; D: Baixo pH do solo.; E: Escassez de água.
58,"O avanço tecnológico da medicina propicia o 
desenvolvimento de tratamento para diversas doenças, 
como as relacionadas à visão. As correções que utilizam 
laser para o tratamento da miopia são consideradas 
seguras até 12 dioptrias, dependendo da espessura e 
curvatura da córnea. Para valores de dioptria superiores a 
esse, o implante de lentes intraoculares é mais indicado. 
Essas lentes, conhecidas como lentes fácicas (LF), são 
implantadas junto à córnea, antecedendo o cristalino (C), 
sem que esse precise ser removido, formando a imagem 
correta sobre a retina (R).
O comportamento de um feixe de luz incidindo no olho 
que possui um implante de lentes fácicas para correção 
do problema de visão apresentado é esquematizado por","A: LF     C               R; B: LF     C               R; C: LF     C               R; D: LF     C               R; E: LF     C               R"
59,"O papel tem na celulose sua matéria-prima, e uma das etapas de sua produção é o branqueamento, que visa 
remover a lignina da celulose. Diferentes processos de branqueamento usam, por exemplo, cloro (Cl2), hipoclorito 
de sódio (NaClO), oxigênio (O2), ozônio (O3) ou peróxido de hidrogênio (H2O2). Alguns processos de branqueamento 
levam à formação de compostos organoclorados. São apresentadas as estruturas de um fragmento da lignina e do 
tetracloroguaiacol, um dos organoclorados formados no processo de branqueamento.
CH O
CH O
CH O
Fragmento da Lignina
CHOH
CH
CH
CH
O
CHOH
CH
CH
CH
CH
CH
CH OH
CH OH
CH
CH OH
CH OH
OCH
OCH
OCH
OCH
OCH
2
2
3
O
O
O
O
O
OH
CI
CI
CI
CI
OCH
Tetracloroguaiacol
SANTOS, C. P. et al. Papel: como se fabrica? Química Nova na Escola, n. 14, 2001 (adaptado).
Os reagentes capazes de levar à formação de organoclorados no processo citado são","A: O2 e O3.; B: Cl2 e O2.; C: H2O2 e Cl2.; D: NaClO e O3.; E: NaClO e Cl2."
60,"A remoção de petróleo derramado em ecossistemas 
marinhos é complexa e muitas vezes envolve a adição de 
mais sustâncias ao ambiente. Para facilitar o processo de 
recuperação dessas áreas, pesquisadores têm estudado 
a bioquímica de bactérias encontradas em locais sujeitos 
a esse tipo de impacto. Eles verificaram que algumas 
dessas espécies utilizam as moléculas de hidrocarbonetos 
como fonte energética, atuando como biorremediadores, 
removendo o óleo do ambiente.
KREPSKY, N.; SILVA SOBRINHO, F.; CRAPEZ, M. A. C. 
Ciência Hoje, n. 223, jan.-fev. 2006 (adaptado).
Para serem eficientes no processo de biorremediação 
citado, as espécies escolhidas devem possuir","A: células flageladas, que capturem as partículas de 
óleo presentes na água.; B: altas taxas de mutação, para se adaptarem ao 
ambiente impactado pelo óleo.; C: enzimas, que catalisem reações de quebra das 
moléculas constituintes do óleo.; D: parede celular espessa, que impossibilite que as 
bactérias se contaminem com o óleo.; E: capacidade de fotossíntese, que possibilite a liberação 
de oxigênio para a renovação do ambiente poluído."
61,"Os calcários são materiais compostos por carbonato 
de cálcio, que podem atuar como sorventes do dióxido 
de enxofre (SO2), um importante poluente atmosférico. 
As reações envolvidas no processo são a ativação do 
calcário, por meio de calcinação, e a fixação do SO2 com 
a formação de um sal de cálcio, como ilustrado pelas 
equações químicas simplificadas.
CaCO3 
calor  CaO + CO2
CaO + SO2 + 1
2  O2 
 Sal de cálcio
Considerando-se as reações envolvidas nesse processo 
de dessulfurização, a fórmula química do sal de cálcio 
corresponde a",A: CaSO3.; B: CaSO4.; C: CaS2O8.; D: CaSO2.; E: CaS2O7.
62,"Uma enzima foi retirada de um dos órgãos do sistema 
digestório de um cachorro e, após ser purificada, foi 
diluída em solução fisiológica e distribuída em três tubos 
de ensaio com os seguintes conteúdos:
•	 Tubo 1: carne
•	 Tubo 2: macarrão
•	 Tubo 3: banha
Em todos os tubos foi adicionado ácido clorídrico (HCl), 
e o pH da solução baixou para um valor próximo a 2. Além 
disso, os tubos foram mantidos por duas horas a uma 
temperatura de 37 °C. A digestão do alimento ocorreu 
somente no tubo 1.
De qual órgão do cachorro a enzima foi retirada?",A: Fígado.; B: Pâncreas.; C: Estômago.; D: Vesícula biliar.; E: Intestino delgado.
63,"Observações astronômicas indicam que no centro 
de nossa galáxia, a Via Láctea, provavelmente exista um 
buraco negro cuja massa é igual a milhares de vezes a 
massa do Sol. Uma técnica simples para estimar a massa 
desse buraco negro consiste em observar algum objeto 
que orbite ao seu redor e medir o período de uma rotação 
completa, T, bem como o raio médio, R, da órbita do objeto, 
que supostamente se desloca, com boa aproximação, em 
movimento circular uniforme. Nessa situação, considere 
que a força resultante, devido ao movimento circular, é 
igual, em magnitude, à força gravitacional que o buraco 
negro exerce sobre o objeto.
A partir do conhecimento do período de rotação, da 
distância média e da constante gravitacional, G, a massa 
do buraco negro é","A: 4p2R 2
GT 
.; B: p2R 3
2GT 
.; C: 2p2R 3
GT 
.; D: 4p2R 3
GT 
.; E: p2R 5
GT 
."
64,"As superbactérias respondem por um número crescente de infecções e mortes em todo o mundo. O termo 
superbactérias é atribuído às bactérias que apresentam resistência a praticamente todos os antibióticos. Dessa forma, 
no organismo de um paciente, a população de uma espécie bacteriana patogênica pode ser constituída principalmente 
por bactérias sensíveis a antibióticos usuais e por um número reduzido de superbactérias que, por mutação ou 
intercâmbio de material genético, tornaram-se resistentes aos antibióticos existentes.
FERREIRA, F. A.; CRUZ, R. S.; FIGUEIREDO, A. M. S. Superbactérias: o problema mundial da resistência a antibióticos. Ciência Hoje, n. 287, nov. 2011 (adaptado).
Qual figura representa o comportamento populacional das bactérias ao longo de uma semana de tratamento 
com um antibiótico comum?","A: 1      2      3      4     5      6      7
Dias de tratamento
Densidade populacional
I
II
I - Bactérias sensíveis ao antibiótico
II -  Bactérias resistentes ao antibiótico; B: 1      2      3      4     5      6      7
I
II
Dias de tratamento
Densidade populacional
I - Bactérias sensíveis ao antibiótico
II -  Bactérias resistentes ao antibiótico; C: 1      2      3      4     5      6      7
I
II
Dias de tratamento
Densidade populacional
I - Bactérias sensíveis ao antibiótico
II -  Bactérias resistentes ao antibiótico; D: 1      2      3      4     5      6      7
I
II
Dias de tratamento
Densidade populacional
I - Bactérias sensíveis ao antibiótico
II -  Bactérias resistentes ao antibiótico; E: 1      2      3      4     5      6      7
I
II
Dias de tratamento
Densidade populacional
I - Bactérias sensíveis ao antibiótico
II -  Bactérias resistentes ao antibiótico"
65,"Em altos-fornos siderúrgicos, as temperaturas acima 
de 600 °C são mensuradas por meio de pirômetros óticos. 
Esses dispositivos apresentam a vantagem de medir a 
temperatura de um objeto aquecido sem necessidade 
de contato. Dentro de um pirômetro ótico, um filamento 
metálico é aquecido pela passagem de corrente elétrica 
até que sua cor seja a mesma que a do objeto aquecido 
em observação. Nessa condição, a temperatura 
conhecida do filamento é idêntica à do objeto aquecido 
em observação.
Disponível em: www.if.usp.br. Acesso em: 4 ago. 2012 (adaptado).
A propriedade da radiação eletromagnética avaliada 
nesse processo é a",A: amplitude.; B: coerência.; C: frequência.; D: intensidade.; E: velocidade.
66,"A 
fenilcetonúria 
é 
uma 
doença 
hereditária 
autossômica recessiva, associada à mutação do 
gene PAH, que limita a metabolização do aminoácido 
fenilalanina. Por isso, é obrigatório, por lei, que 
as embalagens de alimentos, como refrigerantes 
dietéticos, informem a presença de fenilalanina em sua 
composição. Uma mulher portadora de mutação para 
o gene PAH tem três filhos normais, com um homem 
normal, cujo pai sofria de fenilcetonúria, devido à 
mesma mutação no gene PAH encontrada em um dos 
alelos da mulher.
Qual a probabilidade de a quarta criança gerada por 
esses pais apresentar fenilcetonúria?","A: 0%; B: 12,5%; C: 25%; D: 50%; E: 75%"
67,"Num sistema de freio convencional, as rodas do 
carro travam e os pneus derrapam no solo, caso a força 
exercida sobre o pedal seja muito intensa. O sistema 
ABS evita o travamento das rodas, mantendo a força de 
atrito no seu valor estático máximo, sem derrapagem. 
O coeficiente de atrito estático da borracha em contato 
com o concreto vale µe = 1,0 e o coeficiente de atrito 
cinético para o mesmo par de materiais é µc = 0,75. Dois 
carros, com velocidades iniciais iguais a 108 km/h, iniciam 
a frenagem numa estrada perfeitamente horizontal de 
concreto no mesmo ponto. O carro 1 tem sistema ABS e 
utiliza a força de atrito estática máxima para a frenagem; 
já o carro 2 trava as rodas, de maneira que a força de 
atrito efetiva é a cinética. Considere g = 10 m/s2.
As distâncias, medidas a partir do ponto em que iniciam 
a frenagem, que os carros 1 (d1) e 2 (d2) percorrem até 
parar são, respectivamente,","A: d1 = 45 m e d2 = 60 m.; B: d1 = 60 m e d2 = 45 m.; C: d1 = 90 m e d2 = 120 m.; D: d1 = 5,8×102 m e d2 = 7,8×102 m.; E: d1 = 7,8×102 m e d2 = 5,8×102 m."
68,"Cinco indústrias de ramos diferentes foram instaladas 
ao longo do curso de um rio. O descarte dos efluentes 
dessas indústrias acarreta impacto na qualidade de suas 
águas. O pH foi determinado em diferentes pontos desse 
rio, a 25 °C, e os resultados são apresentados no quadro.
Pontos de coleta
Valor do pH
Antes da primeira indústria
5,5
Entre a primeira e a segunda indústria
5,5
Entre a segunda e a terceira indústria
7,5
Entre a terceira e a quarta indústria
7,0
Entre a quarta e a quinta indústria
7,0
Após a quinta indústria
6,5
A indústria que descarta um efluente com características 
básicas é a","A: primeira.; B: segunda.; C: terceira.; D: quarta.; E: quinta."
69,"O poli(ácido lático) ou PLA é um material de interesse tecnológico por ser um polímero biodegradável e bioabsorvível. 
O ácido lático, um metabólito comum no organismo humano, é a matéria-prima para produção do PLA, de acordo com 
a equação química simplificada:
Ácido d/l-lático
100 ≤ n ≤ 10 000
polimerização
HO
HO
HO
O
O
O
HO
O
CH
CH
CH
CH
O
O
n
Que tipo de polímero de condensação é formado nessa reação?",A: Poliéster.; B: Polivinila.; C: Poliamida.; D: Poliuretana.; E: Policarbonato.
70,"O alumínio é um metal bastante versátil, pois, a partir dele, podem-se confeccionar materiais amplamente utilizados 
pela sociedade. A obtenção do alumínio ocorre a partir da bauxita, que é purificada e dissolvida em criolita fundida 
(Na3AlF6) e eletrolisada a cerca de 1 000 °C. Há liberação do gás dióxido de carbono (CO2), formado a partir da reação 
de um dos produtos da eletrólise com o material presente nos eletrodos. O ânodo é formado por barras de grafita 
submergidas na mistura fundida. O cátodo é uma caixa de ferro coberta de grafita. A reação global do processo é:
2 Al2O3 (l) + 3 C (s) → 4 Al (l) + 3 CO2 (g)
Na etapa de obtenção do alumínio líquido, as reações que ocorrem no cátodo e ânodo são:","A: cátodo: Al3+ + 3 e− → Al
ânodo 2 O2− → O2 + 4 e−; C: + O2 → CO2; B: cátodo 2 O2− → O2 + 4 e−; C: + O2 → CO2
ânodo: Al3+ + 3 e− → Al; C: cátodo Al3+ + 3 e− → Al
2 O2− → O2 + 4 e−
ânodo: C + O2 → CO2; D: cátodo Al3+ + 3 e− → Al; C: + O2 → CO2
ânodo: 2 O2− → O2 + 4 e−; E: cátodo: 2 O2− → O2 + 4 e−
ânodo
Al3+ + 3 e− → Al; C: + O2 → CO2"
71,"O quadro apresenta a composição do petróleo.
Fração
Faixa de tamanho 
das moléculas
Faixa de ponto de 
ebulição (°C)
Usos
Gás
C1 a C5
−160 a 30
combustíveis gasosos
Gasolina
C5 a C12
30 a 200
combustível de motor
Querosene
C12 a C18
180 a 400
diesel e combustível de alto-forno
Lubrificantes
maior que C16
maior que 350
lubrificantes
Parafinas
maior que C20
sólidos de baixa fusão
velas e fósforos
Asfalto
maior que C30
resíduos pastosos
pavimentação
BROWN, T. L. et al. Química: a ciência central. São Paulo: Person Prentice Hall, 2005.
Para a separação dos constituintes com o objetivo de produzir a gasolina, o método a ser utilizado é a",A: filtração.; B: destilação.; C: decantação.; D: precipitação.; E: centrifugação.
72,"Um gel vaginal poderá ser um recurso para as mulheres na prevenção contra a aids. Esse produto tem como 
princípio ativo um composto que inibe a transcriptase reversa viral.
Essa ação inibidora é importante, pois a referida enzima","A: corta a dupla hélice do DNA, produzindo um molde para o RNA viral.; B: produz moléculas de DNA viral que vão infectar células sadias.; C: polimeriza molécula de DNA, tendo como molde o RNA viral.; D: promove a entrada do vírus da aids nos linfócitos T.; E: sintetiza os nucleotídeos que compõem o DNA viral."
73,"O Nylon® é um polímero (uma poliamida) obtido pela reação do ácido adípico com a hexametilenodiamina, como 
indicado no esquema reacional.
O
O
HO
HO
N
N
H
H
O
O
(
)
(
)
(
)
(
)
4
+
+
H N
NH
n
n
ácido hexanodioico
(ácido adípico)
1,6-diamino-hexano
(hexametilenodiamina)
Nylon 6,6
H2O
Na época da invenção desse composto, foi proposta uma nomenclatura comercial, baseada no número de átomos 
de carbono do diácido carboxílico, seguido do número de carbonos da diamina.
De acordo com as informações do texto, o nome comercial de uma poliamida resultante da reação do ácido butanodioico 
com o 1,2-diamino-etano é","A: Nylon 4,3.; B: Nylon 6,2.; C: Nylon 3,4.; D: Nylon 4,2.; E: Nylon 2,6."
74,"O vinagre vem sendo usado desde a Antiguidade 
como conservante de alimentos, bem como agente de 
limpeza e condimento. Um dos principais componentes 
do vinagre é o ácido acético (massa molar  60 g/mol), cuja 
faixa de concentração deve se situar entre 4% a 6% (m/v). 
Em um teste de controle de qualidade foram analisadas 
cinco marcas de diferentes vinagres, e as concentrações 
de ácido acético, em mol/L, se encontram no quadro.
Amostra
Concentração de ácido acético (mol/L)
0,007
0,070
0,150
0,400
0,700
RIZZON, L. A. Sistema de produção de vinagre.
Disponível em: www.sistemasdeproducao.cnptia.embrapa.br. 
 Acesso em: 14 ago. 2012 (adaptado).
A amostra de vinagre que se encontra dentro do limite de 
concentração tolerado é a",A: 1.; B: 2.; C: 3.; D: 4.; E: 5.
75,"Os parasitoides são insetos diminutos, que têm 
hábitos bastante peculiares: suas larvas se desenvolvem 
dentro do corpo de outros animais. Em geral, cada 
parasitoide ataca hospedeiros de determinada espécie 
e, por isso, esses organismos vêm sendo amplamente 
usados para o controle biológico de pragas agrícolas.
SANTO, M. M. E. et al. Parasitoides: insetos benéficos e cruéis. 
Ciência Hoje, n. 291, abr. 2012 (adaptado).
O uso desses insetos na agricultura traz benefícios 
ambientais, pois diminui o(a)",A: tempo de produção agrícola.; B: diversidade de insetos-praga.; C: aplicação de inseticidas tóxicos.; D: emprego de fertilizantes agrícolas.; E: necessidade de combate a ervas daninhas.
76,"A figura representa uma embalagem cartonada e 
sua constituição em multicamadas. De acordo com as 
orientações do fabricante, essas embalagens não devem 
ser utilizadas em fornos micro-ondas.
polietileno.....
alumínio......
polietileno...
papel...........
polietileno....
NASCIMENTO, R. M. M. et al. Embalagem cartonada longa vida: lixo ou luxo? 
Química Nova na Escola, n. 25, maio 2007 (adaptado).
A restrição citada deve-se ao fato de a","A: embalagem aberta se expandir pela pressão do vapor 
formado em seu interior.; B: camada de polietileno se danificar, colocando o 
alumínio em contato com o alimento.; C: fina camada de alumínio blindar a radiação, não 
permitindo que o alimento se aqueça.; D: absorção de radiação pelo papel, que se aquece e 
pode levar à queima da camada de polietileno.; E: geração de centelhas na camada de alumínio, 
que pode levar à queima da camada de papel e de 
polietileno.
	"
